{
  "$schema": "https://json-schema.org/draft/2020-12/schema",
  "type": "object",
  "properties": {
    "schema_version": {
      "$ref": "#/$defs/__schema0"
    },
    "conference": {
      "$ref": "#/$defs/__schema1"
    },
    "days": {
      "$ref": "#/$defs/__schema4"
    },
    "sessions": {
      "$ref": "#/$defs/__schema5"
    },
    "people": {
      "$ref": "#/$defs/__schema14"
    }
  },
  "required": [
    "schema_version",
    "conference",
    "days",
    "sessions",
    "people"
  ],
  "additionalProperties": false,
  "title": "ConferenceProgram v1",
  "description": "Provider-independent, whole-program read model consumed by the conference application.",
  "$defs": {
    "__schema0": {
      "type": "number",
      "const": 1
    },
    "__schema1": {
      "type": "object",
      "properties": {
        "id": {
          "type": "string",
          "pattern": "^[a-z0-9]+(?:-[a-z0-9]+)*$"
        },
        "name": {
          "$ref": "#/$defs/__schema2"
        },
        "short_name": {
          "$ref": "#/$defs/__schema2"
        },
        "starts_on": {
          "$ref": "#/$defs/__schema3"
        },
        "ends_on": {
          "$ref": "#/$defs/__schema3"
        },
        "timezone": {
          "$ref": "#/$defs/__schema2"
        }
      },
      "required": [
        "id",
        "name",
        "short_name",
        "starts_on",
        "ends_on",
        "timezone"
      ],
      "additionalProperties": false
    },
    "__schema2": {
      "type": "string",
      "minLength": 1
    },
    "__schema3": {
      "type": "string",
      "pattern": "^\\d{4}-\\d{2}-\\d{2}$"
    },
    "__schema4": {
      "minItems": 1,
      "type": "array",
      "items": {
        "$ref": "#/$defs/__schema3"
      }
    },
    "__schema5": {
      "minItems": 1,
      "type": "array",
      "items": {
        "$ref": "#/$defs/__schema6"
      }
    },
    "__schema6": {
      "type": "object",
      "properties": {
        "kind": {
          "type": "string",
          "enum": [
            "session",
            "poster-session"
          ]
        },
        "id": {
          "$ref": "#/$defs/__schema7"
        },
        "title": {
          "$ref": "#/$defs/__schema2"
        },
        "starts_at": {
          "$ref": "#/$defs/__schema8"
        },
        "ends_at": {
          "$ref": "#/$defs/__schema10"
        },
        "location": {
          "$ref": "#/$defs/__schema11"
        },
        "speaker_ids": {
          "$ref": "#/$defs/__schema12"
        },
        "description_html": {
          "$ref": "#/$defs/__schema13"
        },
        "date": {
          "$ref": "#/$defs/__schema3"
        },
        "category": {
          "$ref": "#/$defs/__schema2"
        },
        "session_number": {
          "$ref": "#/$defs/__schema2"
        },
        "presentations": {
          "type": "array",
          "items": {
            "type": "object",
            "properties": {
              "kind": {
                "type": "string",
                "enum": [
                  "talk",
                  "poster"
                ]
              },
              "id": {
                "$ref": "#/$defs/__schema7"
              },
              "title": {
                "$ref": "#/$defs/__schema2"
              },
              "starts_at": {
                "$ref": "#/$defs/__schema8"
              },
              "ends_at": {
                "$ref": "#/$defs/__schema10"
              },
              "location": {
                "$ref": "#/$defs/__schema11"
              },
              "speaker_ids": {
                "$ref": "#/$defs/__schema12"
              },
              "description_html": {
                "$ref": "#/$defs/__schema13"
              }
            },
            "required": [
              "kind",
              "id",
              "title"
            ],
            "additionalProperties": false
          }
        }
      },
      "required": [
        "kind",
        "id",
        "title",
        "date",
        "presentations"
      ],
      "additionalProperties": false
    },
    "__schema7": {
      "description": "A unique conference-local item identifier.",
      "$ref": "#/$defs/__schema2"
    },
    "__schema8": {
      "$ref": "#/$defs/__schema9"
    },
    "__schema9": {
      "type": "string",
      "pattern": "^\\d{4}-\\d{2}-\\d{2}T\\d{2}:\\d{2}:\\d{2}(?:\\.\\d+)?(?:Z|[+-]\\d{2}:\\d{2})$"
    },
    "__schema10": {
      "$ref": "#/$defs/__schema9"
    },
    "__schema11": {
      "$ref": "#/$defs/__schema2"
    },
    "__schema12": {
      "minItems": 1,
      "type": "array",
      "items": {
        "$ref": "#/$defs/__schema2"
      }
    },
    "__schema13": {
      "description": "Sanitized HTML containing text and bare b, br, sup, sub, i, em, strong, and p tags only.",
      "$ref": "#/$defs/__schema2"
    },
    "__schema14": {
      "type": "object",
      "propertyNames": {
        "$ref": "#/$defs/__schema2"
      },
      "additionalProperties": {
        "type": "object",
        "properties": {
          "name": {
            "$ref": "#/$defs/__schema2"
          },
          "org": {
            "$ref": "#/$defs/__schema2"
          }
        },
        "required": [
          "name"
        ],
        "additionalProperties": false
      }
    }
  },
  "$id": "https://conferences.kozak.ch/schemas/conference-program-v1.schema.json"
}
