{
  "schema_version": 1,
  "conference": {
    "id": "example-2027",
    "name": "Example Research Conference 2027",
    "short_name": "Example 2027",
    "starts_on": "2027-03-01",
    "ends_on": "2027-03-02",
    "timezone": "Europe/Zurich"
  },
  "days": ["2027-03-01", "2027-03-02"],
  "sessions": [
    {
      "kind": "session",
      "id": "session-1",
      "title": "Opening session",
      "starts_at": "2027-03-01T09:00:00+01:00",
      "ends_at": "2027-03-01T10:00:00+01:00",
      "location": "Auditorium",
      "speaker_ids": ["person-1"],
      "description_html": "Welcome to the <strong>example</strong> conference.",
      "date": "2027-03-01",
      "category": "Plenary",
      "session_number": "1",
      "presentations": [
        {
          "kind": "talk",
          "id": "talk-1",
          "title": "A useful result",
          "starts_at": "2027-03-01T09:10:00+01:00",
          "ends_at": "2027-03-01T09:30:00+01:00",
          "speaker_ids": ["person-2"]
        }
      ]
    },
    {
      "kind": "poster-session",
      "id": "posters-1",
      "title": "Poster session",
      "starts_at": "2027-03-02T11:00:00+01:00",
      "ends_at": "2027-03-02T12:00:00+01:00",
      "date": "2027-03-02",
      "presentations": [
        {
          "kind": "poster",
          "id": "poster-1",
          "title": "A visual result",
          "location": "Board 7",
          "speaker_ids": ["person-1"]
        }
      ]
    }
  ],
  "people": {
    "person-1": {
      "name": "Ada Example",
      "org": "Example Institute"
    },
    "person-2": {
      "name": "Grace Sample"
    }
  }
}
